{
  "$schema": "https://json-schema.org/draft/2020-12/schema",
  "type": "object",
  "required": [
    "jsonrpc",
    "id",
    "method",
    "params"
  ],
  "additionalProperties": false,
  "properties": {
    "jsonrpc": {
      "const": "2.0"
    },
    "id": {
      "$ref": "#/$defs/id"
    },
    "method": {
      "const": "ai.models.upsert"
    },
    "params": {
      "$ref": "#/$defs/modelUpsertParams"
    }
  },
  "$defs": {
    "id": {
      "type": "integer",
      "minimum": 1,
      "maximum": 2147483647
    },
    "modelUpsertParams": {
      "type": "object",
      "required": [
        "credentialId",
        "modelId",
        "displayName",
        "contextWindowTokens",
        "maxOutputTokens"
      ],
      "additionalProperties": false,
      "properties": {
        "id": {
          "type": "string",
          "minLength": 1
        },
        "credentialId": {
          "type": "string",
          "minLength": 1
        },
        "modelId": {
          "type": "string",
          "minLength": 1
        },
        "displayName": {
          "type": "string",
          "minLength": 1
        },
        "source": {
          "type": "string"
        },
        "enabled": {
          "type": "boolean"
        },
        "contextWindowTokens": {
          "type": "integer",
          "minimum": 2048
        },
        "maxOutputTokens": {
          "type": "integer",
          "minimum": 1
        },
        "thinkingEnabled": {
          "type": [
            "boolean",
            "null"
          ]
        }
      }
    }
  }
}
